"table","field","field_type","field_description"
"world_bank_data","country_iso3c","character","ISO 3166-1 alpha-3 code for reference country"
"world_bank_data","year","integer","Year in YYYY format"
"world_bank_data","gdp_dollars","numeric","Value for GDP in US Dollars"
"world_bank_data","human_population","numeric","Value for human population size"
"fao_production_data","area","character","Reference country"
"fao_production_data","item_code","integer","FAO code for crop or livestock item"
"fao_production_data","item","character","Name of crop or livestock item"
"fao_production_data","element","character","Type of production measured (e.g. area harvested, quantity by weight, number of animals)"
"fao_production_data","year","integer","Year in YYYY format"
"fao_production_data","unit","character","Units for value"
"fao_production_data","value","numeric","Value for specific crop or livestock item"
"fao_trade_data","reporter_countries","character","Reporter country"
"fao_trade_data","partner_countries","character","Partner country"
"fao_trade_data","item_code","integer","FAO code for crop or livestock item"
"fao_trade_data","item","character","Name of crop or livestock item"
"fao_trade_data","element_code","integer","Code corresponding to import/export, quantity/value, and unit"
"fao_trade_data","element","character","Whether trade is reported as export quantity, export value, import quantity, or import value"
"fao_trade_data","year","integer","Year in YYYY format"
"fao_trade_data","unit","character","Units for value"
"fao_trade_data","value","numeric","Value for trade of specific crop or livestock item"
"fao_trade_data","flag","character","Flags (e.g. official figure, estimated value)"
"iucn_wildlife_data","taxonid","integer","Taxonomic identifier provided by IUCN"
"iucn_wildlife_data","scientific_name","character","Scientific name"
"iucn_wildlife_data","subspecies","character","Subspecies name"
"iucn_wildlife_data","rank","character","Taxonomic rank"
"iucn_wildlife_data","subpopulation","character","Sub-population name"
"iucn_wildlife_data","category","character","IUCN Red List classification"
"iucn_wildlife_data","country","character","Country name"
"vet_population_data","Country","character","Name of reference country"
"vet_population_data","CountryID","character","ISO 3166-1 alpha-3 code for reference country"
"vet_population_data","Year","numeric","Year in YYYY format"
"vet_population_data","Veterinarians - Animal health activities - Public Administration","numeric","Number of veterinarians in animal health activities specifically in public administration"
"vet_population_data","Veterinarians - Animal health activities - Private Accredited Practitioners","numeric","Number of veterinarians in animal health activities specifically as private accredited practitioners"
"vet_population_data","Veterinarians - Animal health activities - total","numeric","Number of veterinarians in animal health activities in total"
"vet_population_data","Veterinarians - Public Health activities - Public Administration","numeric","Number of veterinarians in public health activities specifically in public administration"
"vet_population_data","Veterinarians - Public Health activities - Private Accredited Practitioners","numeric","Number of veterinarians in public health activities specifically as private accredited practitioners"
"vet_population_data","Veterinarians - Public Health activities- total","numeric","Number of veterinarians in public health activities in total"
"vet_population_data","Veterinarians - Laboratories - Public Administration","numeric","Number of veterinarians in laboratories specifically in public administration"
"vet_population_data","Veterinarians - Laboratories - Private Accredited Practitioners","numeric","Number of veterinarians in laboratories specifically as private accredited practitioners"
"vet_population_data","Veterinarians - Laboratories- total","numeric","Number of veterinarians in laboratories in total"
"vet_population_data","Veterinarians - Academic/Training Institutions","numeric","Number of veterinarians in academic/training institutions"
"vet_population_data","Veterinary Paraprofessionals - 'Animal health activities'","numeric","Number of veterinary paraprofessionals in animal health activities"
"vet_population_data","Veterinary Paraprofessionals - 'Community Animal Health workers'","numeric","Number of veterinary paraprofessionals in community animal health activities"
"comtrade_data","type_code","character","Product type: Goods or Services"
"comtrade_data","freq_code","character","The time interval at which observations occur"
"comtrade_data","ref_period_id","integer","The period of time to which the measured observation is intended to refer"
"comtrade_data","ref_year","integer","Year of observation"
"comtrade_data","ref_month","integer","Month of observation. For annual, it would bet set to 52"
"comtrade_data","period","character","Combination of year and month (for monthly), year for (annual)"
"comtrade_data","reporter_code","integer","The country or geographic area to which the measured statistical phenomenon relates"
"comtrade_data","reporter_iso","character","ISO 3 code of reporter"
"comtrade_data","reporter_desc","character","Description of reporter"
"comtrade_data","flow_code","character","Trade flow or sub-flow (exports, re-exports, imports, re-imports, etc.)"
"comtrade_data","flow_desc","character","Description of trade flows"
"comtrade_data","partner_code","integer","The primary partner country or geographic area for the respective trade flow"
"comtrade_data","partner_iso","character","ISO 3 code of 1st partner"
"comtrade_data","partner_desc","character","Description of 1st partner"
"comtrade_data","partner2code","integer","A secondary partner country or geographic area for the respective trade flow"
"comtrade_data","partner2iso","character","ISO 3 code of 2nd partner"
"comtrade_data","partner2desc","character","Description of 2nd partner"
"comtrade_data","classification_code","character","Additional product classification to assist data search"
"comtrade_data","classification_search_code","character","Indicates the product classification used and which version (HS, SITC)"
"comtrade_data","is_original_classification","logical","Flag to indicate whether the classification is reported by country or not"
"comtrade_data","cmd_code","character","Product code in conjunction with classification code"
"comtrade_data","cmd_desc","character","Description of commodity /service category"
"comtrade_data","aggr_level","integer","Hierarchical level of commodity/service category"
"comtrade_data","is_leaf","logical","Identification whether a product code has the most basic level (i.e.,sub-heading for HS)"
"comtrade_data","customs_code","character","Customs or statistical procedure"
"comtrade_data","customs_desc","character","Description of customs procedure"
"comtrade_data","mos_code","character","The mode of supply on delivery of services (trade in services only)"
"comtrade_data","mot_code","integer","The mode of transport used when goods enter or leave the economic territory of a country"
"comtrade_data","mot_desc","character","Description of mode of transport"
"comtrade_data","qty_unit_code","integer","Unit of primary quantity"
"comtrade_data","qty_unit_abbr","character","Abbreviation of primary quantity unit"
"comtrade_data","qty","numeric","Value of primary quantity"
"comtrade_data","is_qty_estimated","logical","Flag whether primary quantity is estimated or not"
"comtrade_data","alt_qty_unit_code","integer","Unit of secondary quantity"
"comtrade_data","alt_qty_unit_abbr","character","Abbreviation of secondary quantity unit"
"comtrade_data","alt_qty","numeric","Value of secondary quantity"
"comtrade_data","is_alt_qty_estimated","logical","Flag whether secondary quantity is estimated or not"
"comtrade_data","net_wgt","numeric","Net weight"
"comtrade_data","is_net_wgt_estimated","logical","Flag whether net weight is estimated or not"
"comtrade_data","gross_wgt","numeric","Gross weight"
"comtrade_data","is_gross_wgt_estimated","logical","Flag whether gross weight is estimated or not"
"comtrade_data","cifvalue","numeric","Trade values in CIF"
"comtrade_data","fobvalue","numeric","Trade values in FOB"
"comtrade_data","primary_value","numeric","Primary trade values (taken from CIF or FOB values)"
"comtrade_data","legacy_estimation_flag","integer","Legacy quantity estimation flag"
"comtrade_data","is_reported","logical","Flag to indicate whether a record is reported by country"
"comtrade_data","is_aggregate","logical","Flag to indicate whether a record is aggregated by UNSD"
"eppo_index_data","pest","character","Name of pest/pathogen"
"eppo_index_data","country","character","Name of reference country"
"eppo_index_data","year_published","character","Year article was published in YYYY format"
"eppo_index_data","issue","character","Issue number in which article was published"
"eppo_index_data","article_number","character","Article number in year/number format"
"eppo_index_data","title","character","Title of article"
"eppo_index_data","keyword1","character","First keyword describing content of article (e.g. new record, detailed record, absence)"
"eppo_index_data","keyword2","character","Second keyword describing content of article"
